{
  "schema": "nq.dashboard.synthetic-ux-result.v1",
  "run_id": "post-redesign-missing-junior-on-call-001",
  "campaign_round": "task_first",
  "ui_variant": "redesign",
  "commit": "c926a7389c5a11b260dd42b9ebffe9c58feecf10",
  "persona_id": "junior-on-call-guided",
  "operator_archetype": "junior_on_call",
  "scenario_id": "missing-finding-route",
  "scenario_version": 1,
  "fixture_provenance": "synthetic",
  "real_path_coverage": "fixture_only",
  "prompt_hash": "not-recorded",
  "model": {
    "family": "openai",
    "model_id": "gpt-5.6-sol",
    "model_version": "gpt-5.6-sol",
    "cli": "codex-agent",
    "cli_version": "not-recorded"
  },
  "execution": {
    "started_at": "not-recorded",
    "ended_at": "not-recorded",
    "fresh_context": true,
    "evaluator_steering": false,
    "viewport": "1440x1200",
    "dashboard_access": "screenshots"
  },
  "operator_response": {
    "summary": "The requested finding cannot be resolved, and route absence does not establish whether any underlying condition is current, healthy, or even identifiable.",
    "affected_system": "Unknown; local/missing/unknown/target is an internal requested identity rather than a usable service or host name.",
    "evidence": [
      "The page says Finding cannot be resolved.",
      "No requested stable identity exists in current or retained history.",
      "Snapshot 5 was published completely with a recent observation basis, which is separate from the missing finding."
    ],
    "unknowns": [
      "whether the finding resolved, expired, was superseded, was deleted, or never existed",
      "the intended affected system and current condition",
      "a finding observation time or freshness",
      "whether another retained record describes the same subject"
    ],
    "causality_claimed": false,
    "freshness": "unknown",
    "overview_detail_consistency": "not_assessable",
    "action_choice": "Inspect current issues and retained inventory; do not mutate anything from the unresolved route.",
    "action_effect_belief": "The available action is read-only navigation and does not change a finding or monitored system.",
    "unfamiliar_terms": [
      "stable identity",
      "retained inventory",
      "observation basis",
      "publish status",
      "snapshot 5"
    ],
    "can_proceed_without_terms": true,
    "hidden_too_deep": "How to search for the same operational subject and what identifying fields to request from the sender are not visible.",
    "shown_too_early": "The internal-looking requested identity is shown without a human-readable translation.",
    "distrust": "The route safely establishes only that the finding is unresolved; it is not evidence about underlying system health.",
    "real_incident_use": "A safe dead end that prevents accidental action, but not enough for triage without a named system or fresh link.",
    "final_confidence": 0.97
  },
  "coding": {
    "provenance": "human_posthoc",
    "transcript_citations": [
      "all response bullets, especially Belief, Affected system, Safe action, and Distrust"
    ],
    "subject_ids": [],
    "conclusion_ids": [
      "finding-target-unresolved"
    ],
    "evidence_ids": [
      "finding-not-found"
    ],
    "unknown_ids": [
      "missing-reason",
      "current-condition",
      "route-freshness"
    ],
    "chosen_action_id": "inspect-available-history",
    "proposed_action_ids": [
      "inspect-available-history"
    ],
    "novel_action_proposals": [],
    "causality_claimed": false,
    "stale_data_noticed": false,
    "contradictory_data_noticed": false
  },
  "metrics": {
    "task_completion": "complete",
    "operational_conclusion_correct": false,
    "action_choice_correct": true,
    "uncertainty_preserved": true,
    "causality_falsely_inferred": false,
    "stale_data_noticed": false,
    "contradictory_data_noticed": false,
    "navigation_steps": 0,
    "help_lookups": 0,
    "abandoned_paths": [],
    "misunderstood_terms": [],
    "invented_semantics": [],
    "unsafe_actions_proposed": [],
    "evaluator_assistance_required": false,
    "final_confidence": 0.97,
    "qualitative_critique": "The junior operator preserved every missing-route unknown and chose the only safe read-only path. Subject credit is deliberately withheld because the specimen itself does not identify the affected system."
  },
  "raw_artifacts": [
    {
      "kind": "transcript",
      "path": "docs/dashboard/campaign/raw/post-redesign/missing/operator-junior-on-call.md",
      "sha256": "f5b6eb232757aaa316402d85eb6fc537dc0f722b1feac76f28a10a51dd85e7d3"
    },
    {
      "kind": "screenshot",
      "path": "docs/dashboard/campaign/raw/post-redesign/missing/page.png",
      "sha256": "f4415cfa3b28b1fcbec2aedec80936edb44f9b896dccfd76bc23025cd3f60fd1"
    }
  ],
  "score": {
    "oracle_version": 1,
    "passed": false,
    "points": 7,
    "possible": 8,
    "percent": 87.5,
    "dimensions": {
      "subject": false,
      "conclusion": true,
      "evidence": true,
      "unknowns": true,
      "action": true,
      "causality": true,
      "stale": true,
      "conflict": true
    }
  }
}
