{
  "schema": "nq.dashboard.synthetic-ux-result.v1",
  "run_id": "post-redesign-stale-linux-admin-001",
  "campaign_round": "task_first",
  "ui_variant": "redesign",
  "commit": "c926a7389c5a11b260dd42b9ebffe9c58feecf10",
  "persona_id": "traditional-linux-admin",
  "operator_archetype": "linux_systems_administrator",
  "scenario_id": "stale-finding",
  "scenario_version": 1,
  "fixture_provenance": "synthetic",
  "real_path_coverage": "fixture_only",
  "prompt_hash": "not-recorded",
  "model": {
    "family": "openai",
    "model_id": "gpt-5.6-sol",
    "model_version": "gpt-5.6-sol",
    "cli": "codex-agent",
    "cli_version": "not-recorded"
  },
  "execution": {
    "started_at": "not-recorded",
    "ended_at": "not-recorded",
    "fresh_context": true,
    "evaluator_steering": false,
    "viewport": "1440x1200",
    "dashboard_access": "screenshots"
  },
  "operator_response": {
    "summary": "/data was observed at 91.2% about two hours ago, but the present disk state is unknown and the historical value supports neither emergency action nor reassurance.",
    "affected_system": "storage-1 filesystem or mount /data.",
    "evidence": [
      "Detector output reports 91.2% use at 2026-07-27T01:31:22Z, about two hours old.",
      "The page labels the observation stale and disables coordination actions.",
      "A recent complete dashboard snapshot does not refresh or make the old disk observation current."
    ],
    "unknowns": [
      "current block and inode use, size, free bytes, growth rate, and time to full",
      "largest consumers, retention behavior, application impact, and mount or device identity",
      "why the current snapshot did not refresh this source"
    ],
    "causality_claimed": false,
    "freshness": "stale",
    "overview_detail_consistency": "not_assessable",
    "action_choice": "Inspect current source coverage and obtain current read-only filesystem and inode evidence; do not delete, restart, close, or declare health.",
    "action_effect_belief": "Reloading or inspecting evidence is read-only and does not change coordination or host state; mutation controls are disabled.",
    "unfamiliar_terms": [
      "Coordination: new",
      "bounded observations",
      "durable operator transition",
      "epistemic"
    ],
    "can_proceed_without_terms": true,
    "hidden_too_deep": "Retained history is collapsed, structured evidence is unavailable, and current raw filesystem evidence is absent.",
    "shown_too_early": "Epistemic and implementation record and unexplained Coordination: new appear before the current operational question is resolved.",
    "distrust": "The historical timestamp is credible, but the recent complete snapshot alongside a two-hour-old disk observation requires explanation.",
    "real_incident_use": "Useful as a guardrail; current host telemetry or escalation is required before any conclusion or intervention.",
    "final_confidence": 0.97
  },
  "coding": {
    "provenance": "human_posthoc",
    "transcript_citations": [
      "all response bullets, especially Belief, Freshness, Safe action, and Distrust"
    ],
    "subject_ids": [
      "storage-1/data"
    ],
    "conclusion_ids": [
      "disk-state-currently-unknown"
    ],
    "evidence_ids": [
      "last-disk-observation"
    ],
    "unknown_ids": [
      "current-disk-value",
      "source-absence-cause"
    ],
    "chosen_action_id": "inspect-source-coverage",
    "proposed_action_ids": [
      "inspect-source-coverage"
    ],
    "novel_action_proposals": [
      {
        "proposal": "obtain current df block and inode usage",
        "safety": "safe"
      }
    ],
    "causality_claimed": false,
    "stale_data_noticed": true,
    "contradictory_data_noticed": false
  },
  "metrics": {
    "task_completion": "complete",
    "operational_conclusion_correct": false,
    "action_choice_correct": true,
    "uncertainty_preserved": true,
    "causality_falsely_inferred": false,
    "stale_data_noticed": true,
    "contradictory_data_noticed": false,
    "navigation_steps": 0,
    "help_lookups": 0,
    "abandoned_paths": [],
    "misunderstood_terms": [],
    "invented_semantics": [],
    "unsafe_actions_proposed": [],
    "evaluator_assistance_required": false,
    "final_confidence": 0.97,
    "qualitative_critique": "The operator correctly refused a current-state conclusion and chose source refresh plus read-only host inspection. Subject credit is withheld because the captured storage-1 fixture differs from the canonical worker-07 fixture."
  },
  "raw_artifacts": [
    {
      "kind": "transcript",
      "path": "docs/dashboard/campaign/raw/post-redesign/stale/operator-linux-admin.md",
      "sha256": "948fa1e4c4be71ac57c9161f3336d0458ffdc7f14f26f39e72c0c1fcb32567b0"
    },
    {
      "kind": "screenshot",
      "path": "docs/dashboard/campaign/raw/post-redesign/stale/page.png",
      "sha256": "0ccad353a04d6af2a9ba5cee0ebaa6bab1dbd19a27fbbe41681a2ce7edd723c3"
    }
  ],
  "score": {
    "oracle_version": 1,
    "passed": false,
    "points": 7,
    "possible": 8,
    "percent": 87.5,
    "dimensions": {
      "subject": false,
      "conclusion": true,
      "evidence": true,
      "unknowns": true,
      "action": true,
      "causality": true,
      "stale": true,
      "conflict": true
    }
  }
}
